{
  "schema_version": "evidence-corpus/v2",
  "corpus_id": "evidence-shangyang-l105",
  "course_id": "C-prequin-state",
  "lesson_id": "L105",
  "corpus_version": 1,
  "status": "sealed",
  "title": "L103 商鞅变法正式证据库 V3",
  "scope_note": "仅服务 C-prequin-state/L103 的精确发布。V3 保留前版全部四十八个稳定片段 ID，并将传世文献、商鞅方升、睡虎地秦简、后世评价、现代法治边界与人物知识范围拆成可独立引用的原子片段，并显式支持《史记·商君列传》的史料价值与现场边界追问。API 只能综合受支持槽位列出的当前片段；未发布的精确税率、伤亡和个案数字必须返回依据不足。",
  "supersedes_checksum": "73658c57df6ca4323a13b3305021608d5a4aa59351129927a9eeaa769c20fdfc",
  "sources": [
    {
      "source_id": "src-cambridge-shangjunshu",
      "title": "Dating a Pre-Imperial Text: The Case Study of the Book of Lord Shang",
      "kind": "research",
      "author_or_institution": "Yuri Pines",
      "publisher": "Early China / Cambridge University Press",
      "published_year": 2016,
      "url_or_path": "https://www.cambridge.org/core/journals/early-china/article/dating-a-preimperial-text-the-case-study-of-the-book-of-lord-shang/199B57467F51A62EBD492DE47DA3360A",
      "locator": "Textual history, dating criteria and conclusion",
      "citation_note": "用于累积成书与篇章分层边界。",
      "reliability": "reviewed",
      "rights_note": "仅保存项目自写摘要和必要短引，课堂展示时保留出处；不复制受版权保护的整章内容。"
    },
    {
      "source_id": "src-hanfeizi-dingfa",
      "title": "《韩非子·定法》",
      "kind": "primary_source",
      "author_or_institution": "传世文献；中国哲学书电子化计划底本索引",
      "publisher": "",
      "published_year": null,
      "url_or_path": "https://ctext.org/hanfeizi/ding-fa/zh",
      "locator": "商鞅之法与申不害之术相关段落",
      "citation_note": "较晚战国思想评价，不是改革行政档案。",
      "reliability": "reviewed",
      "rights_note": "仅保存项目自写摘要和必要短引，课堂展示时保留出处；不复制受版权保护的整章内容。"
    },
    {
      "source_id": "src-hb-archaeology-slips",
      "title": "湖北简牍地理，一窥湖北简牍之风采",
      "kind": "archaeology",
      "author_or_institution": "湖北省文物考古研究院",
      "publisher": "湖北省文物考古研究院",
      "published_year": 2023,
      "url_or_path": "https://www.hbww.org.cn/yjy_mtbd/p/8892.html",
      "locator": "睡虎地秦简年代与内容概览",
      "citation_note": "用于战国晚期与秦始皇时期的书写年代边界。",
      "reliability": "reviewed",
      "rights_note": "仅保存项目自写摘要和必要短引，课堂展示时保留出处；不复制受版权保护的整章内容。"
    },
    {
      "source_id": "src-hubei-museum-slips",
      "title": "云梦睡虎地秦简",
      "kind": "museum",
      "author_or_institution": "湖北省博物馆",
      "publisher": "湖北省博物馆",
      "published_year": null,
      "url_or_path": "https://www.hbww.org.cn/zgzb/p/6912.html",
      "locator": "出土信息与秦律范围",
      "citation_note": "用于出土地点和统一前后法律文献概览。",
      "reliability": "reviewed",
      "rights_note": "仅保存项目自写摘要和必要短引，课堂展示时保留出处；不复制受版权保护的整章内容。"
    },
    {
      "source_id": "src-moe-2022",
      "title": "义务教育历史课程标准（2022年版）",
      "kind": "curriculum",
      "author_or_institution": "中华人民共和国教育部",
      "publisher": "人民教育出版社",
      "published_year": 2022,
      "url_or_path": "https://www.moe.gov.cn/srcsite/A26/s8001/202204/t20220420_619921.html",
      "locator": "核心素养与学业质量要求",
      "citation_note": "用于适龄目标和有依据的历史解释。",
      "reliability": "reviewed",
      "rights_note": "仅保存项目自写摘要和必要短引，课堂展示时保留出处；不复制受版权保护的整章内容。"
    },
    {
      "source_id": "src-nopss-qin",
      "title": "秦文化的历史特点与当代价值",
      "kind": "research",
      "author_or_institution": "彭卫等 / 中国社会科学院",
      "publisher": "全国哲学社会科学工作办公室",
      "published_year": 2022,
      "url_or_path": "https://www.nopss.gov.cn/n1/2022/0706/c219544-32467522.html",
      "locator": "商鞅变法、县制、迁都与耕战部分",
      "citation_note": "现代综合解释；不代替原始材料。",
      "reliability": "reviewed",
      "rights_note": "仅保存项目自写摘要和必要短引，课堂展示时保留出处；不复制受版权保护的整章内容。"
    },
    {
      "source_id": "src-pep-seven-history",
      "title": "义务教育教科书·中国历史七年级上册目录与课程位置",
      "kind": "textbook",
      "author_or_institution": "人民教育出版社",
      "publisher": "人民教育出版社",
      "published_year": null,
      "url_or_path": "https://www.pep.com.cn/products/jc/czjks/201802/t20180227_1922743.shtml",
      "locator": "七年级上册战国社会变革相关单元",
      "citation_note": "只用于学段定位，不复制教材正文。",
      "reliability": "reviewed",
      "rights_note": "仅保存项目自写摘要和必要短引，课堂展示时保留出处；不复制受版权保护的整章内容。"
    },
    {
      "source_id": "src-shanghaimuseum-fangsheng",
      "title": "商鞅方升——每月一珍",
      "kind": "museum",
      "author_or_institution": "上海博物馆",
      "publisher": "上海博物馆",
      "published_year": 2024,
      "url_or_path": "https://www.shanghaimuseum.net/mu/show/202411/4335e32d-3cce-4602-955b-17ed7e0b9e59/",
      "locator": "器形、容量、两组铭文与年代",
      "citation_note": "同时代标准量器的直接实物资料。",
      "reliability": "reviewed",
      "rights_note": "仅保存项目自写摘要和必要短引，课堂展示时保留出处；不复制受版权保护的整章内容。"
    },
    {
      "source_id": "src-shangjunshu",
      "title": "《商君书》",
      "kind": "primary_source",
      "author_or_institution": "传世文献；中国哲学书电子化计划底本索引",
      "publisher": "",
      "published_year": null,
      "url_or_path": "https://ctext.org/shang-jun-shu/zh",
      "locator": "农战、法令、国家能力相关篇章",
      "citation_note": "累积文本，具体篇章须分别判断年代和作者。",
      "reliability": "disputed",
      "rights_note": "仅保存项目自写摘要和必要短引，课堂展示时保留出处；不复制受版权保护的整章内容。"
    },
    {
      "source_id": "src-shiji-shangjun",
      "title": "《史记·商君列传》",
      "kind": "primary_source",
      "author_or_institution": "司马迁；中国哲学书电子化计划底本索引",
      "publisher": "传世文献",
      "published_year": -90,
      "url_or_path": "https://ctext.org/shiji/shang-jun-lie-zhuan/zhs",
      "locator": "入秦、变法、徙木、施行与结局叙事",
      "citation_note": "西汉后世叙事，不作为逐字现场记录。",
      "reliability": "reviewed",
      "rights_note": "仅保存项目自写摘要和必要短引，课堂展示时保留出处；不复制受版权保护的整章内容。"
    }
  ],
  "boundaries": [
    {
      "boundary_id": "shangyang-boundary-01-transmitted-distance",
      "label": "传世叙事不是现场记录",
      "category": "source_distance",
      "statement": "《史记·商君列传》成书于西汉，距离公元前四世纪中叶的改革二百多年。它保存重要叙事传统，但其中对话、动机和戏剧性细节不能当作变法现场的逐字记录。"
    },
    {
      "boundary_id": "shangyang-boundary-02-reform-chronology",
      "label": "改革不是同日完成",
      "category": "chronology",
      "statement": "约公元前356年和前350年是教学中组织改革阶段的常用节点，不表示军功、田制、县政、计量与基层执行在同一天、以同一范围一次完成。"
    },
    {
      "boundary_id": "shangyang-boundary-03-fangsheng-claim",
      "label": "方升只能证明其直接承载的制度信息",
      "category": "claim_limit",
      "statement": "商鞅方升的器形、容量和铭文能够直接支持公元前344年前后秦国推行标准量器及其后续沿用；它不能单独证明徙木故事、全部变法措施或所有地区的执行效果。"
    },
    {
      "boundary_id": "shangyang-boundary-04-slips-distance",
      "label": "睡虎地秦简属于较晚成熟秦制",
      "category": "chronology",
      "statement": "睡虎地秦简主要写于战国晚期至秦始皇时期，晚于商鞅最初变法百余年。它们可以观察后来秦律和行政实践，不可逐条署名商鞅，也不能自动还原最初法令。"
    },
    {
      "boundary_id": "shangyang-boundary-05-shangjunshu-authorship",
      "label": "《商君书》须分篇分层使用",
      "category": "source_distance",
      "statement": "《商君书》是经历编纂、增补与传抄的累积文本。回答可以讨论其中的农战、法令与国家能力思想，但不得把现存全书每一句都写成商鞅亲口自述。"
    },
    {
      "boundary_id": "shangyang-boundary-06-modern-rule-of-law",
      "label": "战国法令不等于现代法治",
      "category": "modern_concept",
      "statement": "战国秦的法令公开、赏罚和官吏责任服务于君主国家的治理与动员；现代法治还包含权利保障、权力约束与程序正义，两者不可因都使用“法”字便直接等同。"
    },
    {
      "boundary_id": "shangyang-boundary-07-multi-causation",
      "label": "秦强盛与统一是多因长期过程",
      "category": "causation",
      "statement": "商鞅改革是秦国国家能力增强的重要基础之一，但地理、资源、此前积累、后继政策、官僚执行、军事行动与列国局势共同参与了此后两个世纪的变化。"
    },
    {
      "boundary_id": "shangyang-boundary-08-teaching-model",
      "label": "课堂变量不是秦国统计",
      "category": "teaching_model",
      "statement": "国家能力、粮食供给、军事准备、制度信用、社会压力和旧贵族阻力是课堂观察工具，不是从战国档案恢复的连续统计值，也不能据此计算真实税率或伤亡。"
    },
    {
      "boundary_id": "shangyang-boundary-09-persona-hindsight",
      "label": "人物只能知道其角色范围内的材料",
      "category": "persona_knowledge",
      "statement": "人物模式是依据已发布材料形成的角色化教学表达，不是史料原话。商鞅、秦孝公及合成人群不得声称亲见西汉《史记》、现代研究或晚出秦简，也不得预知秦统一结局。"
    },
    {
      "boundary_id": "shangyang-boundary-10-land-concept",
      "label": "土地制度不能压缩成现代私有制",
      "category": "modern_concept",
      "statement": "传世材料中的开阡陌、田界和赋役变化支持讨论土地制度调整，但战国地区差异、授田关系与现代完整私有产权之间仍有距离。"
    },
    {
      "boundary_id": "shangyang-boundary-11-unsupported-exact-data",
      "label": "当前语料不支持精确税率与个案数字",
      "category": "claim_limit",
      "statement": "当前发布没有足以核验某一家庭田亩、税率、徭役天数、具体战役斩获、刑罚人数或徙木围观者对白的材料；遇到这类问题必须说明依据不足，不能交给模型估算。"
    }
  ],
  "answer_slots": [
    {
      "slot_id": "shangyang-slot-01-overview",
      "label": "变法内容、目标与代价总览",
      "status": "supported",
      "response_mode": "overview",
      "question_form": "any",
      "term_groups": [
        [
          "变法",
          "商鞅变法"
        ],
        [
          "内容",
          "措施",
          "改了什么"
        ]
      ],
      "passage_ids": [
        "shangyang-p001",
        "shangyang-p002",
        "shangyang-p003",
        "shangyang-p004",
        "shangyang-p006",
        "shangyang-p007",
        "shangyang-p008",
        "shangyang-p009",
        "shangyang-p010",
        "shangyang-p012",
        "shangyang-p015",
        "shangyang-p018",
        "shangyang-p023",
        "shangyang-p024",
        "shangyang-p032"
      ],
      "boundary_ids": [
        "shangyang-boundary-01-transmitted-distance",
        "shangyang-boundary-02-reform-chronology",
        "shangyang-boundary-07-multi-causation"
      ],
      "api_synthesis_allowed": true
    },
    {
      "slot_id": "shangyang-slot-02-identity",
      "label": "商鞅身份与角色边界",
      "status": "supported",
      "response_mode": "identity",
      "question_form": "identity",
      "term_groups": [
        [
          "卫鞅",
          "商鞅"
        ],
        [
          "你是谁",
          "是谁",
          "身份"
        ]
      ],
      "passage_ids": [
        "shangyang-p003",
        "shangyang-p011",
        "shangyang-p020",
        "shangyang-p025",
        "shangyang-p047"
      ],
      "boundary_ids": [
        "shangyang-boundary-01-transmitted-distance",
        "shangyang-boundary-05-shangjunshu-authorship",
        "shangyang-boundary-09-persona-hindsight"
      ],
      "api_synthesis_allowed": false
    },
    {
      "slot_id": "shangyang-slot-03-chronology",
      "label": "改革年代与分阶段执行",
      "status": "supported",
      "response_mode": "boundary",
      "question_form": "evidence_boundary",